{
  "asset_id": "EXAMPLE01",
  "title": "An example content asset",
  "summary": "Demonstrates the Content Asset envelope shape for schema validation only — not a real repository asset.",
  "topic_package": {
    "topic_id": "topic_01J9EXAMPLE",
    "working_title": "Example working title",
    "audience": "Example audience",
    "primary_goal": "Example goal",
    "funnel_stage": "consideration",
    "core_message": "Example core message.",
    "supporting_points": ["Example point one", "Example point two"],
    "cta": "Example CTA",
    "keywords": ["example"],
    "brand_voice": "confident-direct",
    "status": "approved",
    "created_date": "2026-08-01T00:00:00Z",
    "updated_date": "2026-08-01T00:00:00Z",
    "version": 1,
    "schema_version": "1.0",
    "source": "backlog",
    "backlog_reference_id": "EXAMPLE01",
    "content_pillar": null,
    "tags": [],
    "priority": null,
    "related_topic_ids": [],
    "locale": "en",
    "owner": "chris@digitallyconnected.net",
    "notes": null
  },
  "status": "approved",
  "created_at": "2026-08-01T00:00:00Z",
  "metadata": null
}
