{
  "asset_id": "GS01",
  "title": "Why your Google Search ranking dropped this quarter",
  "summary": "A ranking drop is almost always fixable once you know which signal actually moved.",
  "topic_package": {
    "topic_id": "topic_01J9GS01AB",
    "working_title": "Why your Google Search ranking dropped this quarter",
    "audience": "Owner-operators running 10-50 staff service businesses",
    "primary_goal": "Book a discovery call",
    "funnel_stage": "consideration",
    "core_message": "A ranking drop is almost always fixable once you know which signal actually moved.",
    "supporting_points": [
      "Most ranking drops trace back to one of three signals, not a mystery algorithm change",
      "A quick technical audit finds the real cause in under a day",
      "Fixing the right signal recovers rank faster than publishing new content"
    ],
    "cta": "Book your ranking audit",
    "keywords": ["seo ranking drop", "google search console"],
    "brand_voice": "confident-direct",
    "status": "approved",
    "created_date": "2026-08-01T09:00:00Z",
    "updated_date": "2026-08-01T09:00:00Z",
    "version": 1,
    "schema_version": "1.0",
    "source": "backlog",
    "backlog_reference_id": "GS01",
    "content_pillar": "seo fundamentals",
    "tags": ["evergreen", "seo"],
    "priority": null,
    "related_topic_ids": [],
    "locale": "en",
    "owner": "chris@digitallyconnected.net",
    "notes": "DC-003-I016 approved fixture, promoted to the Content Asset Repository by DC-003-I018. GS01 does not represent a real article/source asset yet; see README 'Content Asset Repository — current limitation'."
  },
  "status": "approved",
  "created_at": "2026-08-01T09:00:00Z",
  "metadata": {
    "origin": "DC-003-I016 approved fixture, promoted to the repository by DC-003-I018",
    "is_real_article_source": false
  }
}
